[
  {
    "id": "ev_demo_corp_001_audit_2024",
    "schema_version": "1",
    "kb_doc_id": "kbd_corp_001_audit_2024_q4",
    "excerpt": "经审计的合并资产负债表显示 · 截至 2024 年 12 月 31 日 · 流动资产合计 4.82 亿元 · 流动负债合计 2.79 亿元 · 流动比率 1.73 · 资产负债率 58.3%。",
    "span": {"start": 2148, "end": 2247},
    "freshness": "fresh",
    "data_tier": 2,
    "related_artifact_ids": ["art_credit_decision_demo_corp_001"],
    "cite_in_message_ids": ["msg_credit_001_explain_002"],
    "decision_id": "ledger_credit_demo_corp_001",
    "evidence_date": "2026-03-12T00:00:00Z",
    "retrieved_at": "2026-05-11T09:20:50Z",
    "source_url": "https://annual-report.example.cn/2024/cangulan-precision-q4-audited.pdf",
    "source_tier": "government"
  },
  {
    "id": "ev_demo_corp_001_industry_2026_q1",
    "schema_version": "1",
    "kb_doc_id": "kbd_industry_c34_2026_q1",
    "excerpt": "通用设备制造业（C34）2026 年一季度行业景气指数 65.3 · 较去年同期上行 2.1 个百分点 · 政策敏感度评分 0.34 · 周期性属性中等偏弱。",
    "span": {"start": 412, "end": 503},
    "freshness": "fresh",
    "data_tier": 3,
    "related_artifact_ids": ["art_credit_decision_demo_corp_001"],
    "cite_in_message_ids": ["msg_credit_001_explain_003"],
    "evidence_date": "2026-01-31T00:00:00Z",
    "retrieved_at": "2026-05-11T09:21:02Z",
    "source_url": "https://industry-research.example.cn/c34/2026q1-prosperity-report.pdf",
    "source_tier": "industry"
  },
  {
    "id": "ev_demo_corp_001_case_2025_q3",
    "schema_version": "1",
    "kb_doc_id": "kbd_internal_case_c34_2025_q3",
    "excerpt": "内部案例库：同行业（C34）已成交客户共 18 户 · 平均授信额度 2300 万 · 平均期限 30 月 · 担保覆盖率中位 1.42 · 不良率 1.8%。",
    "span": {"start": 0, "end": 95},
    "freshness": "fresh",
    "data_tier": 1,
    "related_artifact_ids": ["art_credit_decision_demo_corp_001"],
    "cite_in_message_ids": [],
    "decision_id": "ledger_credit_demo_corp_001",
    "evidence_date": "2025-09-03T00:00:00Z",
    "retrieved_at": "2026-05-11T09:21:08Z",
    "source_url": "internal://crm/case-study/c34-corp-credit-2025q3.json",
    "source_tier": "internal_authoritative"
  },
  {
    "id": "ev_demo_corp_001_news_2025_q4",
    "schema_version": "1",
    "kb_doc_id": "kbd_news_corp_001_2025_q4",
    "excerpt": "（2025 年 10 月某科技媒体）沧澜精密机械拟扩产 · 新建智能加工车间预计 2026 年中投产 · 总投资 1.2 亿元 · 自有资金占比 60%。",
    "span": {"start": 220, "end": 305},
    "freshness": "critical",
    "data_tier": 4,
    "related_artifact_ids": ["art_credit_decision_demo_corp_001"],
    "cite_in_message_ids": ["msg_credit_001_explain_005"],
    "evidence_date": "2025-10-23T00:00:00Z",
    "retrieved_at": "2026-05-11T09:21:10Z",
    "source_url": "https://news.example.com/2025/10/cangulan-precision-expansion.html",
    "source_tier": "public_web"
  },
  {
    "id": "ev_demo_corp_001_news_2025_q2",
    "schema_version": "1",
    "kb_doc_id": "kbd_news_corp_001_2025_q2",
    "excerpt": "（2025 年 5 月行业资讯）通用设备制造行业某头部厂商签约下游汽车零部件订单 · 订单金额 8000 万 · 交付周期 18 月。",
    "span": {"start": 88, "end": 168},
    "freshness": "expired",
    "data_tier": 4,
    "related_artifact_ids": [],
    "cite_in_message_ids": [],
    "evidence_date": "2025-05-26T00:00:00Z",
    "retrieved_at": "2026-05-11T09:21:15Z",
    "source_url": "https://news.example.com/2025/05/c34-orders-recap.html",
    "source_tier": "public_web"
  }
]
